lineId	chId	mId	chName	dialogue
L524785	u7754	m525	CARTMAN	I saw him!! I saw Kenny!!
L524784	u7755	m525	CARTMAN'S MOTHER	Eric?! Eric, what is it?!
L524782	u7755	m525	CARTMAN'S MOTHER	Sure, hon. Goodnight.
L524781	u7754	m525	CARTMAN	If you went down on a horse... You'd tell me, right?
L524780	u7755	m525	CARTMAN'S MOTHER	Yes, hon?
L524779	u7754	m525	CARTMAN	Mom...
L524778	u7755	m525	CARTMAN'S MOTHER	Oh.
L524777	u7754	m525	CARTMAN	Oh, I don't care, I was just asking cuz all my favorite TV shows have been replaced by news and it's pissing me off.
L524776	u7755	m525	CARTMAN'S MOTHER	I don't know honey. Soon we hope. You want it to end quickly, huh?
L524775	u7754	m525	CARTMAN	Mom... When is the war gonna be over?
L524774	u7755	m525	CARTMAN'S MOTHER	Goodnight, honey.
L524397	u7754	m525	CARTMAN	But mom!  I'm not fucking addicted to fucking bad language!  I don't have a fucking problem!
L524396	u7755	m525	CARTMAN'S MOTHER	Eric!  Don't talk to Ms. Brovlofski that way!
L524028	u7754	m525	CARTMAN	What the hell are you guys doing here?
L524027	u7755	m525	CARTMAN'S MOTHER	Look, Eric it's your little friends.
L524542	u7764	m525	MR. MACKEY	No, Eric... I'm afraid it's phase two for you...
L524541	u7754	m525	CARTMAN	HOW THE FUCK CAN YOU NOT GRADUATE ME?! DOES THAT MEAN I HAVE TO STAY HERE?!
L524540	u7764	m525	MR. MACKEY	Wendy, Mkay, if you want to start getting political, I'll throw your skinny little butt right back into rehab. Mkay?
L524530	u7764	m525	MR. MACKEY	The rest of you are graduated. You can go home today.
L524529	u7754	m525	CARTMAN	Oh yeah.
L524528	u7764	m525	MR. MACKEY	Norwegian Ass Raper.
L524527	u7754	m525	CARTMAN	The N word?
L524526	u7764	m525	MR. MACKEY	Uh, except for you Eric. I'm afraid you need to work more on not saying the F word and the N word.
L524525	u7754	m525	CARTMAN	Thank God, that sucked ass.
L524488	u7764	m525	MR. MACKEY	I am not a prickfuck, mkay? You little asshole!
L524487	u7754	m525	CARTMAN	Help yourself prickfuck!
L524486	u7764	m525	MR. MACKEY	Eric!!!!  You need to be rehabilitated. Help me to help you!
L524485	u7754	m525	CARTMAN	You get me Cheesy Poofs with the delightful cheddar crunch, and I'll watch my fucking mouth!
L524484	u7764	m525	MR. MACKEY	Eric, you're not watching your mouth!
L524483	u7754	m525	CARTMAN	Oh man, I'm gonna need a cherry pie to get the taste of ass out of my mouth from that piece of shit movie.
L524482	u7764	m525	MR. MACKEY	So you see, the point and the theme of the film is kept intact. And of course, the MPAA didn't cut out any of the graphic violence. What did you think?
L524433	u7754	m525	CARTMAN	God Damn it your mom is a bitch, Kyle.
L524432	u7764	m525	MR. MACKEY	Mkay.
L524418	u7764	m525	MR. MACKEY	Mkay, you see, children. This is exactly what I'm talking about. We have to change the way you think.
L524417	u7754	m525	CARTMAN	What? Fuck French people. Fuck 'em in the ear.
L524416	u7764	m525	MR. MACKEY	Eric, that is not appropriate.
L524415	u7754	m525	CARTMAN	You've got a stupid accent too.
L524413	u7764	m525	MR. MACKEY	Mkay, kids from all over the State have been brought here, because you all share the same problem. Uh, young man... Let's start with you.
L524412	u7754	m525	CARTMAN	Ugh... You guys, seriously... I'm having Cheesy Poof withdrawal...
L525076	u7755	m525	CARTMAN'S MOTHER	Eric?
L525075	u7762	m525	KYLE'S MOTHER	Kyle?!
L524388	u7762	m525	KYLE'S MOTHER	I know what it is!
L524387	u7755	m525	CARTMAN'S MOTHER	Oh, he said rim job.  It's when someone licks your ass for-
L524386	u7762	m525	KYLE'S MOTHER	What was that word, young man!?
L524296	u7762	m525	KYLE'S MOTHER	This is it! The time for action is NOW!!  <b>Something must be done! This is like a spreading rash! They're pulling out our children's brains and filling them with trash! Can't you see what this is leading to? A world of smut and sex and poo! I believe the good fight has begun! Something must be done!</b>
L524295	u7755	m525	CARTMAN'S MOTHER	You bastards.
L524183	u7762	m525	KYLE'S MOTHER	Young man, you will tell Peincipal Victoria THIS INSTANT where you heard all these horrible phrases!
L524182	u7755	m525	CARTMAN'S MOTHER	What?
L525216	u7756	m525	CHEF	It's that v-chip thing that's inside you, Eric!  The polarity must have been reversed by the electric chair!
L525215	u7761	m525	KYLE	Look at that!
L524647	u7756	m525	CHEF	Something big, children.
L524646	u7761	m525	KYLE	What's going on, Chef?
L524635	u7756	m525	CHEF	Children, I know ALL there is to know about women.
L524634	u7761	m525	KYLE	I don't know.
L524633	u7756	m525	CHEF	Ha! Is the Pope Catholic?
L524629	u7756	m525	CHEF	A hunger strike? For what?
L524628	u7761	m525	KYLE	We can't, we're on a hunger strike.
L524658	u7756	m525	CHEF	It's... It's not good children.
L524657	u7770	m525	STAN	Chef, what does it mean that we're at war?
L524640	u7770	m525	STAN	No, what does that mean, find the clitoris?
L524639	u7756	m525	CHEF	Oops, I guess you haven't got that far in your anatomy class, huh?
L524638	u7770	m525	STAN	Huh?
L524637	u7756	m525	CHEF	Oh that's easy, you just gotta find the clitoris.
L524636	u7770	m525	STAN	What's the secret to making a woman happy?
L524627	u7756	m525	CHEF	How would like some Salisbury Steak with buttered noodles?
L524626	u7770	m525	STAN	Hey, Chef.
L524625	u7756	m525	CHEF	Hello there, children!!
L524849	u7758	m525	GREGORY	This will be very dangerous... Are you quite sure?
L524848	u7770	m525	STAN	WE'RE going! WE started La Resistance to save Terrance and Phillip! We're going!
L524842	u7770	m525	STAN	What?
L524841	u7758	m525	GREGORY	May I?
L524829	u7758	m525	GREGORY	This is the place--
L524828	u7770	m525	STAN	Oh no, it's that kid.
L524827	u7758	m525	GREGORY	Viva la Resistance.
L524120	u7758	m525	GREGORY	My name is Gregory. I have been Wendy's counter-cousin for some time.
L524119	u7770	m525	STAN	Who are you, kid?
L525167	u7759	m525	IKE	Baba mama!
L525166	u7761	m525	KYLE	Yes I am!
L524760	u7761	m525	KYLE	Goodnight, Ike, we're all going to bed.
L524759	u7759	m525	IKE	Uhh...
L524758	u7761	m525	KYLE	You stay up here in the attic, Ike. Don't make any noises or nothing, okay?
L524746	u7759	m525	IKE	Papa mama simi.
L524745	u7761	m525	KYLE	Get out of here Ike, you're too young for this stuff!
L524744	u7759	m525	IKE	Ber dada!
L524084	u7759	m525	IKE	Doky maping she deeder!!!
L524083	u7761	m525	KYLE	Donkey raping shit eater.
L524060	u7761	m525	KYLE	Be quiet, Ike! The movie's starting!
L524059	u7759	m525	IKE	Purpre mama!
L525262	u7760	m525	KENNY	Mph rm.
L525261	u7769	m525	SATAN	Very well, then. I will put an end to the war as your wish and make everything as it was before the war started. But you Kenny, must remain dead.
L525124	u7769	m525	SATAN	Then move out of the way.
L525123	u7760	m525	KENNY	Mph mph.
L525014	u7769	m525	SATAN	Get everyone in hell ready. When the blood of Terrance and Phillip spills, the day is ours!
L525013	u7760	m525	KENNY	Mph rmph rm!
L524928	u7760	m525	KENNY	Mph rm. Rmph rm rmph rm.
L524927	u7769	m525	SATAN	What do you mean?! I could leave him if I wanted to!
L524926	u7760	m525	KENNY	Mph rmph rm rmph rm.
L524925	u7769	m525	SATAN	Him? I don't know... He can be nice... sometimes.
L524924	u7760	m525	KENNY	Mph rmph rm rmph rm?
L524923	u7769	m525	SATAN	What are you doing?! Get on with your misery!
L524403	u7760	m525	KENNY	MPH RM!!!
L524402	u7769	m525	SATAN	I am Satan. I am your God, now.
L524401	u7769	m525	SATAN	Fallen one... We have such sights to show you!
L524400	u7760	m525	KENNY	MMMMMPHPHPHPHP!!!!!
L524556	u7768	m525	SADDAM HUSSEIN	I wouldn't bullshit you kid! Snacky Smores are now available in stores everywhere! No biggie!
L524555	u7760	m525	KENNY	Mrph?
L524552	u7768	m525	SADDAM HUSSEIN	Oh, you want out of hell, huh?
L524551	u7760	m525	KENNY	Mph rmph rm rmph rmph rm!
L524548	u7768	m525	SADDAM HUSSEIN	A deal? You wanna make a deal with the devil. Well sure, deals are mounds o' fun.
L524547	u7760	m525	KENNY	Mrph mprhm mm rmph!
L524546	u7768	m525	SADDAM HUSSEIN	What? What do you mean you don't belong here? Relax guy, hell is for children.
L524545	u7760	m525	KENNY	Mrph mprph!!
L524544	u7768	m525	SADDAM HUSSEIN	Hey, relax Satan. Don't get all worked up. You're gonna give yourself an ulcer again.
L525095	u7762	m525	KYLE'S MOTHER	KYLE BROVLOFSKI, YOU WATCH YOUR LANGUAGE!!
L525094	u7761	m525	KYLE	YOU GOTTA BE FUCKING KIDDING ME!!
L525091	u7762	m525	KYLE'S MOTHER	Boobie... This is the only way you're ever going to learn. I have an opportunity here to teach you about consequences.
L525090	u7761	m525	KYLE	MOM!!!
L525089	u7762	m525	KYLE'S MOTHER	No... The General is right.
L524392	u7762	m525	KYLE'S MOTHER	You boys need help.  There are rehab centers that specialize in treating people with chronic addictions to bad language.
L524391	u7761	m525	KYLE	What's that?
L524381	u7761	m525	KYLE	We already know what you did. We saw it on television.
L524380	u7762	m525	KYLE'S MOTHER	Boys, we have to have a difficult discussion.
L524344	u7761	m525	KYLE	Dude, what the hell is going on?
L524343	u7762	m525	KYLE'S MOTHER	Terrance and Phillip, you are under arrest for working in America without the proper documents! WE GOT YOU!
L524018	u7762	m525	KYLE'S MOTHER	Do as I say, Kyle!
L524017	u7761	m525	KYLE	Aw, ma!!
L524016	u7762	m525	KYLE'S MOTHER	Kyle, you take your little brother out to play with you!
L525049	u7774	m525	VOICE	FREEZE!!
L525048	u7761	m525	KYLE	SHIT!
L524826	u7761	m525	KYLE	Okay.
L524825	u7774	m525	VOICE	Uhh... Bacon.
L524824	u7761	m525	KYLE	Guess.
L524823	u7774	m525	VOICE	Uhh... I don't know.
L524822	u7761	m525	KYLE	What's the password?
L524821	u7774	m525	VOICE	Uhh... I'm here for La Resistance.
L524820	u7761	m525	KYLE	Who is it?
L525046	u7761	m525	KYLE	No, I mean WE CAN'T LEAVE WITHOUT YOU - we don't know where the hell we are!!
L525045	u7773	m525	THE MOLE	It's okay, I am done for.
L525044	u7761	m525	KYLE	We can't leave without you!
L525043	u7773	m525	THE MOLE	It's so very cold...
L525008	u7773	m525	THE MOLE	Oh... Alright, back you go.
L525007	u7761	m525	KYLE	No! That's not Terrance or Phillip!
L524983	u7773	m525	THE MOLE	Careful? Was my mother careful when she stabbed me in the heart with a clothes hanger while I was still in ze womb?
L524982	u7761	m525	KYLE	Be careful, dude.
L524976	u7761	m525	KYLE	Kay.
L524975	u7773	m525	THE MOLE	Gwpaapa. Gwpaapa.
L524974	u7761	m525	KYLE	What's a dying giraffe sound like?
L524973	u7773	m525	THE MOLE	Now listen carefully. Stan and Kyle, you stand watch here and await my return. If any guards come by, make a sound like a dying giraffe.
L524972	u7773	m525	THE MOLE	For pooping, silly.
L524971	u7761	m525	KYLE	What's a butfor?
L524966	u7773	m525	THE MOLE	Sheet.  Did you bring ze mirror?
L524965	u7761	m525	KYLE	Dude, we don't have watches.
L524943	u7773	m525	THE MOLE	Time? Did time matter to the Revolutionists who were forced to eat their own shit while dying in the dungeons of ze King?
L524942	u7761	m525	KYLE	That's gonna take a long time!
L524941	u7773	m525	THE MOLE	No. Zey must have zem inside. We will have to dig.
L524940	u7761	m525	KYLE	Do you see them?  Do you see Terrance and Phillip?
L524938	u7773	m525	THE MOLE	God? ...Let me tell you something about God... He is ze biggest bitch of zem all.
L524937	u7761	m525	KYLE	Oh my God...
L524885	u7773	m525	THE MOLE	America... She iz a beetch that sheets on her own children.
L524884	u7761	m525	KYLE	Yeah, I guess.
L524883	u7773	m525	THE MOLE	So... We must free more Canadian prizoners?
L525277	u7761	m525	KYLE	Yeah, so what if you say uncle raper or dicksucker or, or-
L525276	u7770	m525	STAN	Mom, I'm a man. Just a man. And I'm going to have fun with profanity just like you and dad did when you were little.
L525274	u7770	m525	STAN	Yeah, but you know, I learned something today.  I learned that getting all worked up over fuck and shit and cockmaster is just stupid... You all focused so hard on erasing profanity that you forgot the most important thing... To love each other.
L525273	u7761	m525	KYLE	Whew, I'm sure glad that's over.
L525270	u7770	m525	STAN	Yeah, thanks for going back to hell for us. You're a real pal.
L525269	u7761	m525	KYLE	Thank you, Kenny.
L525256	u7770	m525	STAN	Are you sure, Kenny?
L525255	u7761	m525	KYLE	WHAT?
L525172	u7761	m525	KYLE	Sweet.
L525171	u7770	m525	STAN	Dude, I found the clitoris! I think I can get Wendy to like me now!
L525170	u7761	m525	KYLE	Stan!
L525035	u7761	m525	KYLE	Did you shut the alarm off, Cartman?
L525034	u7770	m525	STAN	Oh, brother.
L524837	u7770	m525	STAN	Me?!
L524836	u7761	m525	KYLE	I thought you had something planned.
L524835	u7770	m525	STAN	Yeah, so what do we say?
L524834	u7761	m525	KYLE	Wow, a lot of people showed up.
L524751	u7761	m525	KYLE	No, dude, all you have to do is hit the keys really fast and say a bunch of stupid shit and it works.
L524750	u7770	m525	STAN	Dude, do you know what you're doing?
L524737	u7761	m525	KYLE	I'll just try the first one.
L524736	u7770	m525	STAN	Wow!
L524735	u7761	m525	KYLE	Found Eight Million Pages With the Word Clitoris!
L524734	u7761	m525	KYLE	Okay...
L524733	u7770	m525	STAN	Wait! Before we put a message out, do a search on the word 'clitoris'.
L524732	u7761	m525	KYLE	Okay... I just need to find a few private message boards...
L524726	u7770	m525	STAN	I agree! The only way to save our future is to unite and fight!  <b>Something must be done! We must take action fast! My parents have gotten so strict they forgot they were children in the past!</b>
L524725	u7761	m525	KYLE	I don't know. But it has gone far enough! I'm sick of it!  <b>Something must be done! Change has got to come around! They're taking all our laughter and burning it to the ground! Can't you see what this is leading to? A world of chains and ties and glue! We have to fight before they've taken every one! Something must be done!</b>
L524722	u7770	m525	STAN	What has the world come to? This is horrible. We're locked up, burning books, hating other people-
L524721	u7761	m525	KYLE	It's only a matter of time before my mom has HIM burned too!
L524701	u7761	m525	KYLE	Isn't that in Arizona or something?
L524700	u7770	m525	STAN	All it says is that it's above the vulva... But where the hell is the vulva?
L524699	u7761	m525	KYLE	Does it say what the clitoris is?
L524623	u7761	m525	KYLE	Yeah, they suck.
L524622	u7770	m525	STAN	I'm so sick of these soldiers.
L524608	u7770	m525	STAN	Totally!
L524607	u7761	m525	KYLE	This is sweet!!
L524600	u7770	m525	STAN	Dude!  It's the V-chip!  It shocks him ever time he cusses!
L524599	u7761	m525	KYLE	Whoa!  What the hell was that?!
L524595	u7770	m525	STAN	What's the difference?
L524594	u7761	m525	KYLE	Hey, Cartman, did they put that V-chip in your head or your ass?
L524593	u7761	m525	KYLE	Good thing she was never your girlfriend... Dude, here comes Cartman.
L524592	u7770	m525	STAN	I bet she would if my name was GREGORY!!
L524591	u7761	m525	KYLE	Wow, dude. Wendy could really give a rats ass about you.
L524523	u7770	m525	STAN	She's Not! But if she WAS it would be THAT little asshole who's fucking it up for me!
L524522	u7761	m525	KYLE	I thought she wasn't your girlfriend, dude.
L524521	u7770	m525	STAN	That British dickhole is what's taking Wendy away from me!
L524520	u7761	m525	KYLE	I don't know, dude.
L524519	u7770	m525	STAN	What? What don't I get?  What don't I get?
L524509	u7770	m525	STAN	How do we do that?
L524508	u7761	m525	KYLE	Dude, let's help Terrance and Phillip!!
L524355	u7761	m525	KYLE	Our moms suck!
L524354	u7770	m525	STAN	Dude, our moms arrested Terrance and Phillip!
L524316	u7761	m525	KYLE	It isn't fair!
L524315	u7770	m525	STAN	How can they do this?
L524288	u7761	m525	KYLE	You bastards!!
L524287	u7770	m525	STAN	Oh my God! THEY killed Kenny!
L524264	u7761	m525	KYLE	YOU BASTARD!!
L524263	u7770	m525	STAN	OH MY GOD!! YOU KILLED KENNY!!
L524256	u7770	m525	STAN	Yeah...
L524255	u7761	m525	KYLE	Dude, anybody who doesn't think Terrance and Phillip is funny can fuck off anyways.
L524170	u7770	m525	STAN	Yeah!
L524169	u7761	m525	KYLE	I'VE heard them from Mr. Garrison a few times before...
L524168	u7770	m525	STAN	Nowhere.
L524161	u7761	m525	KYLE	Yeah, let's swear we won't tell!
L524160	u7770	m525	STAN	Now remember, don't tell anybody we saw the Terrance and Phillip movie!
L524126	u7770	m525	STAN	She's not my girlfriend, dude!
L524125	u7761	m525	KYLE	Woa, dude, who's your girlfriend's new guy?
L524114	u7761	m525	KYLE	Aw, God Damn it, he's singing that fucking song again.
L524113	u7770	m525	STAN	<b>Thank my lucky stars Here before me now Is everything I'd ever hoped for Knew it in a word Saw it in a glance The only thing I think I'd die for...</b>
L524065	u7770	m525	STAN	Where do they come up with this stuff?!
L524064	u7761	m525	KYLE	That was sweet!
L524048	u7761	m525	KYLE	We HAVE to see this movie, dude!
L524047	u7770	m525	STAN	This is terrible! This can't be happening!!
L524013	u7770	m525	STAN	Kyle, check it out.
L524012	u7761	m525	KYLE	Hey, dudes... Aren't you supposed to go to church, Kenny?
L525279	u7771	m525	STAN'S MOTHER	-Or monkey fucker-
L525278	u7762	m525	KYLE'S MOTHER	Shiteater-
L525155	u7771	m525	STAN'S MOTHER	We're going to find our boys! For God's sake Sheila, you almost had them killed!!
L525154	u7762	m525	KYLE'S MOTHER	WHERE ARE YOU GOING?! We need to stop the not pretty things from letting our children be born in hospitals!
L525152	u7762	m525	KYLE'S MOTHER	Wake up, people!  We all have to do things that aren't pretty sometimes! It's the not pretty things that make life worth fighting the not pretty things for! Why do you think children have to be born in hospitals?
L525151	u7771	m525	STAN'S MOTHER	Oh Lord, what have we done...?
L525093	u7762	m525	KYLE'S MOTHER	YES! AND I WILL NOT ALLOW MY CHILDREN TO BE RUINED BY SMUT!!  I am sorry young man, but I have had it up to here! STRAP THEM IN!
L525092	u7771	m525	STAN'S MOTHER	Sheila, you're going to far! Those are YOUR children!
L524294	u7771	m525	STAN'S MOTHER	He was killed doing something he saw in the movie. It was Terrance and Phillip... THEY killed Kenny.
L524293	u7762	m525	KYLE'S MOTHER	I knew this would happen! Those bastard Canadians have now killed a child! Can't people see the damage that film is doing?!
L524180	u7762	m525	KYLE'S MOTHER	What is 'fisting'?
L524179	u7771	m525	STAN'S MOTHER	Oh dear God...
L524771	u7766	m525	PRESIDENT	Right away, ma'am!
L524770	u7762	m525	KYLE'S MOTHER	I'm needing lunch.
L524769	u7766	m525	PRESIDENT	Yes?
L524768	u7762	m525	KYLE'S MOTHER	And Bill?
L524767	u7766	m525	PRESIDENT	Yes ma'am!
L524766	u7762	m525	KYLE'S MOTHER	Well find out where that signal is coming from!  Then hunt them down like dogs! Any and all Canadian influence must be stopped at all cost!
L524765	u7766	m525	PRESIDENT	Ma'am, we're tracking a resistance... It's probably Canadian spies!!
L524671	u7762	m525	KYLE'S MOTHER	Not necessary?!  Mr. President, may I remind you that our country's heart and soul are at stake, and our children's minds are the battlefield! The bastard Canadians want to fight us because we won't tolerate their potty mouths. Well, if it is war they want... THEN WAR THEY SHALL HAVE!!!
L524670	u7766	m525	PRESIDENT	Oh, uh...  I don't know if air strikes are necessary.
L524669	u7762	m525	KYLE'S MOTHER	We have to have air strikes on their military and entertainment centers.  It's the only way to ensure that their smut can't reach American soil!
L524668	u7766	m525	PRESIDENT	Huh?
L524667	u7762	m525	KYLE'S MOTHER	What about air strikes?
L524666	u7766	m525	PRESIDENT	As Commander in chief, I have ordered our Army to set up defensive positions along the US-Canada border in anticipation of an attack.
L524665	u7762	m525	KYLE'S MOTHER	My fellow Americans. I have led this fight in the War against profanity. I have founded Mothers Against Canada.  Our neighbor to the north has abused us for the last time.
L525197	u7762	m525	KYLE'S MOTHER	Oh God... What have I done...
L525196	u7769	m525	SATAN	SILENCE!!!  NOW!!!  EVERYONE BOW DOWN TO ME!!!
L525195	u7762	m525	KYLE'S MOTHER	And I thought my mother was the master of guilt.  Geez Louise.
L525194	u7769	m525	SATAN	Yes... And in doing so, you brought enough anger and intolerance to the world to allow my coming.
L525191	u7769	m525	SATAN	YOU HAVE SPILLED THE BLOOD OF THE INNOCENTS. NOW THE WORLD BELONGS TO ME... NOW BEGINS TWO MILLION YEARS OF DARKNESS!!  AND ALL THANKS TO YOU!!!
L525190	u7762	m525	KYLE'S MOTHER	Oh.
L525189	u7769	m525	SATAN	SILENCE!  I AM SATAN!
L525188	u7762	m525	KYLE'S MOTHER	Oh no you don't! This is MY fight!! I don't need your help, Alan Dershwitz!
L525187	u7769	m525	SATAN	I am the dark master!
L525186	u7762	m525	KYLE'S MOTHER	What the hell is going on?!
L525185	u7769	m525	SATAN	You're all part of Satan's army now!
L524202	u7762	m525	KYLE'S MOTHER	You are officially relieved of your duties as principal of this school!
L524201	u7767	m525	PRINCIPAL VICTORIA	But I-
L524200	u7762	m525	KYLE'S MOTHER	Yes Principal Victoria.  The PTA is impeaching you.
L524199	u7767	m525	PRINCIPAL VICTORIA	Article 42!  You don't mean-?!
L524198	u7762	m525	KYLE'S MOTHER	Forgive me for saying so, Principal Victoria, but your methods are too... Shall we say... soft?  As head of the PTA, I am exercising my right under article 42 of the PTA code.
L524197	u7767	m525	PRINCIPAL VICTORIA	Ooh yes. I think we'll have to give detention to those boys.
L524196	u7762	m525	KYLE'S MOTHER	We must take action on this immediately.
L524191	u7767	m525	PRINCIPAL VICTORIA	Well, it looks like I'll have to send a warning letter out to parents. I have to put a stop to this before MORE children see 'Terrance and Phillip'.
L524190	u7762	m525	KYLE'S MOTHER	Terrance and Phillip are two VERY untalented, unfunny actors from Canada. Their TV show is filled with toilet humor and bad language and is just complete garbage.  Now it appears they have a movie and I'm positive it's not suitable for children!
L524189	u7767	m525	PRINCIPAL VICTORIA	What is Terrance and Phillip?
L524188	u7762	m525	KYLE'S MOTHER	Terrance and Phillip MOVIE?! Oy gevalt! Not again!
L524178	u7767	m525	PRINCIPAL VICTORIA	No, worse. Here's a short list of the things they've been saying.
L524177	u7762	m525	KYLE'S MOTHER	The F word?!
L524176	u7767	m525	PRINCIPAL VICTORIA	No, it was worse than that...
L524175	u7762	m525	KYLE'S MOTHER	What did my son say, Principal Victoria? Did he say the S word?
L524497	u7764	m525	MR. MACKEY	Alright, I'll make the call...
L524496	u7762	m525	KYLE'S MOTHER	I don't care if it's dangerous! Desperate times call for desperate measures, Mr. Mackey. Perhaps I need to remind you of your situation.
L524495	u7764	m525	MR. MACKEY	Mrs. Brovlofski, the V-chip hasn't been fully tested yet, it could be dangerous.
L524494	u7762	m525	KYLE'S MOTHER	Then we'll have to resort to plan B and call the v-chip organization.
L524493	u7764	m525	MR. MACKEY	Well, some of the children just don't respond to 12 step programs.
L524492	u7762	m525	KYLE'S MOTHER	What do you mean MOST, why not ALL?
L524491	u7764	m525	MR. MACKEY	Very encouraging. Most of the children have been weened from their naughty mouths.
L524490	u7762	m525	KYLE'S MOTHER	How is the children's progress?
L524431	u7762	m525	KYLE'S MOTHER	This is NOT a place for fun and games! This is rehabilitation! Now GET TO IT!! We at MAC have a trial to go to!
L524430	u7764	m525	MR. MACKEY	Uh, we're just, starting our program...
L525246	u7772	m525	TERRANCE	Indeedy, that was a delicious choice of words!
L525245	u7765	m525	PHILLIP	You're quite a purveyor of filth, little boy!
L525162	u7765	m525	PHILLIP	Terrance! NO!
L525161	u7772	m525	TERRANCE	AGH!
L525158	u7772	m525	TERRANCE	You did? Just now?
L525157	u7765	m525	PHILLIP	Did you hear that, Terrance? I farted!
L525121	u7772	m525	TERRANCE	Canada is saving us!!
L525120	u7765	m525	PHILLIP	What's going on Terrance?
L525063	u7765	m525	PHILLIP	I know, Terrance. I know.
L525062	u7772	m525	TERRANCE	Phillip, this is worse than that trip to Quebec City when I fell asleep in that disco.
L525058	u7765	m525	PHILLIP	I know, Terrance.  This is quite the shitstorm we've found ourselves in this time.
L525057	u7772	m525	TERRANCE	Oh, Phillip.  This cannot be good.
L524478	u7765	m525	PHILLIP	You would know, dummy.
L524477	u7772	m525	TERRANCE	Oh, you are such a maroon!
L524452	u7765	m525	PHILLIP	Yeah, God, no wonder your country is so fucked up.
L524451	u7772	m525	TERRANCE	The problem is you don't allow your children to think for themselves. You try to raise them in a protective bubble, and then when they finally get old enough, they realize they've been lied to, and they resent you for it.
L524446	u7765	m525	PHILLIP	Don't believe the hype!!
L524445	u7772	m525	TERRANCE	The young boy that died lit himself on fire. It was unfortunate, but how can they blame US?
L524444	u7765	m525	PHILLIP	Fight the power!
L524347	u7772	m525	TERRANCE	And you call yourself a Canadian!  I told you we should of done Leno!
L524346	u7765	m525	PHILLIP	This little scrotum sucker willfully deceived us!  You are a bad man!
L524345	u7772	m525	TERRANCE	Phillip, we've been tricked and ambushed by The Conan O'Brian Show!!
L524333	u7765	m525	PHILLIP	Cheers, Terrance!
L524332	u7772	m525	TERRANCE	Good one, Phillip!  Cheers.
L524325	u7772	m525	TERRANCE	Hello, Brooke Shields!
L524324	u7765	m525	PHILLIP	Hello, Conan!
L524241	u7772	m525	TERRANCE	I sure did, Phillip!!
L524240	u7765	m525	PHILLIP	HA HA HA! You burned yourself to death by lighting the fart! HA HA HA!!
L524239	u7765	m525	PHILLIP	You bet, Terrance!
L524238	u7772	m525	TERRANCE	Say Phillip, want to see the Northern Lights?
L524237	u7765	m525	PHILLIP	I did, Terrance, I learned that you are a boner biting dick fart fuck face!
L524236	u7772	m525	TERRANCE	Well, Terrance I hope you learned something from this whole experience.
